{
  "$schema": "./site-config.schema.json",
  "version": 1,
  "generated_at": "2026-05-11T16:55:00-03:00",
  "featured": [
    {
      "long_form_id": "DW3F1OHfZeo",
      "short_form_ids": [
        "1m9rl_lxits",
        "scK-D1Eg7PY"
      ]
    },
    {
      "long_form_id": "D0tZ5NaRobM",
      "short_form_ids": [
        "de-cT8ZLQzs"
      ]
    },
    {
      "long_form_id": "DaEP-ij-1KA",
      "short_form_ids": [
        "AT9g-2yrS5s",
        "UkEXXO-o8b8",
        "i9px6iapZd4"
      ]
    }
  ],
  "sections": [
    {
      "id": "long-form",
      "title": "Long-form",
      "video_ids": [
        "KZYFvgajyPE",
        "_lZYR2VkZTg",
        "WOGQI0PAjEU",
        "gVQEYRTtm68",
        "ATH4PvNxWNA",
        "mnO5bES3eQY",
        "WZLSVMVS5o4",
        "JgEullP4AVo",
        "EcOX5FeP2w4",
        "vP1rwg-rzcI",
        "TZfM1yfkFn4",
        "C1ivkljLWAw"
      ]
    },
    {
      "id": "short-form",
      "title": "Short-form",
      "video_ids": [
        "7452871620013903150",
        "DIOkD4iMlUJ",
        "DODyPfskkr6",
        "Z4YkUiEVufg",
        "DMqBVM4NTsc",
        "RXdWLha8dcM",
        "C71usvjJhMM",
        "DNdanV2MM2i",
        "gC4SC8j58pI",
        "DDprhgUyhfZ",
        "C1_1fTOOtRS",
        "C-6GOVvv96_"
      ]
    },
    {
      "id": "motion-design",
      "title": "Motion Design",
      "video_ids": []
    }
  ]
}
